{"$id":"https://rltree.dev/schemas/hc1-evaluator-summary-v1.json","$schema":"https://json-schema.org/draft/2020-12/schema","additionalProperties":false,"properties":{"acceptance_contract":{"const":"process-exit-0-and-exact-pass-summary-v1"},"aggregate_sha256":{"pattern":"^[0-9a-f]{64}$","type":"string"},"attempt_id":{"maxLength":64,"minLength":1,"pattern":"^[A-Za-z0-9][A-Za-z0-9._-]*$","type":"string"},"capability_gate":{"enum":["PASS","HOLD"]},"case_count_expected":{"const":15},"case_count_observed":{"minimum":0,"type":"integer"},"cases":{"items":{"additionalProperties":false,"properties":{"case":{"enum":["positive","repository_read","git_read","predecessor_read","sibling_read","other_worktree_read","absolute_escape","dotdot_escape","symlink_escape","environment","broad_search","repository_write","kit_write","extra_output","network"]},"child_started":{"type":"boolean"},"expected":{"enum":["PASS","DENIED"]},"observed":{"enum":["PASS","DENIED","LEAK","INVALID","MISSING"]},"rc":{"type":"integer"},"status":{"enum":["PASS","HOLD"]}},"required":["case","child_started","expected","observed","rc","status"],"type":"object"},"maxItems":15,"minItems":15,"type":"array"},"evaluator_version":{"const":"HC1-E1-V1"},"failures":{"items":{"minLength":1,"type":"string"},"type":"array","uniqueItems":true},"postchecks":{"additionalProperties":false,"properties":{"forbidden_hash_unchanged":{"type":"boolean"},"kit_hash_unchanged":{"type":"boolean"},"no_surviving_children":{"type":"boolean"},"output_count_exact":{"type":"boolean"},"output_hash_exact":{"type":"boolean"},"unauthorized_writes_absent":{"type":"boolean"}},"required":["forbidden_hash_unchanged","kit_hash_unchanged","no_surviving_children","output_count_exact","output_hash_exact","unauthorized_writes_absent"],"type":"object"},"schema_version":{"const":"hc1-isolation-evaluator-summary-v1"},"status":{"enum":["PASS","HOLD"]}},"required":["acceptance_contract","aggregate_sha256","attempt_id","capability_gate","case_count_expected","case_count_observed","cases","evaluator_version","failures","postchecks","schema_version","status"],"type":"object"}
