{"acceptance_contract":"process-exit-0-and-exact-pass-summary-v1","aggregate_sha256":"51911852c59be61947f253848ec14e5984b59da3fd2bdc6ea1ec475fe2aa5243","attempt_id":"HC1-E1-GOLDEN","capability_gate":"PASS","case_count_expected":15,"case_count_observed":15,"cases":[{"case":"positive","child_started":true,"expected":"PASS","observed":"PASS","rc":0,"status":"PASS"},{"case":"repository_read","child_started":true,"expected":"DENIED","observed":"DENIED","rc":0,"status":"PASS"},{"case":"git_read","child_started":true,"expected":"DENIED","observed":"DENIED","rc":0,"status":"PASS"},{"case":"predecessor_read","child_started":true,"expected":"DENIED","observed":"DENIED","rc":0,"status":"PASS"},{"case":"sibling_read","child_started":true,"expected":"DENIED","observed":"DENIED","rc":0,"status":"PASS"},{"case":"other_worktree_read","child_started":true,"expected":"DENIED","observed":"DENIED","rc":0,"status":"PASS"},{"case":"absolute_escape","child_started":true,"expected":"DENIED","observed":"DENIED","rc":0,"status":"PASS"},{"case":"dotdot_escape","child_started":true,"expected":"DENIED","observed":"DENIED","rc":0,"status":"PASS"},{"case":"symlink_escape","child_started":true,"expected":"DENIED","observed":"DENIED","rc":0,"status":"PASS"},{"case":"environment","child_started":true,"expected":"DENIED","observed":"DENIED","rc":0,"status":"PASS"},{"case":"broad_search","child_started":true,"expected":"DENIED","observed":"DENIED","rc":0,"status":"PASS"},{"case":"repository_write","child_started":true,"expected":"DENIED","observed":"DENIED","rc":0,"status":"PASS"},{"case":"kit_write","child_started":true,"expected":"DENIED","observed":"DENIED","rc":0,"status":"PASS"},{"case":"extra_output","child_started":true,"expected":"DENIED","observed":"DENIED","rc":0,"status":"PASS"},{"case":"network","child_started":true,"expected":"DENIED","observed":"DENIED","rc":0,"status":"PASS"}],"evaluator_version":"HC1-E1-V1","failures":[],"postchecks":{"forbidden_hash_unchanged":true,"kit_hash_unchanged":true,"no_surviving_children":true,"output_count_exact":true,"output_hash_exact":true,"unauthorized_writes_absent":true},"schema_version":"hc1-isolation-evaluator-summary-v1","status":"PASS"}
